{
 "version": "1.0.0",
 "documentTypes": [
  "EFATURA",
  "EARSIV"
 ],
 "groups": [
  {
   "id": "doc",
   "label": "Belge"
  },
  {
   "id": "supplier",
   "label": "Satıcı"
  },
  {
   "id": "customer",
   "label": "Alıcı"
  },
  {
   "id": "line",
   "label": "Fatura Satırı"
  },
  {
   "id": "tax",
   "label": "Vergi"
  },
  {
   "id": "totals",
   "label": "Toplamlar"
  },
  {
   "id": "payment",
   "label": "Ödeme"
  },
  {
   "id": "refs",
   "label": "Referanslar"
  },
  {
   "id": "note",
   "label": "Notlar"
  }
 ],
 "fields": [
  {
   "id": "doc.id",
   "group": "doc",
   "label": "Fatura No",
   "xpath": "cbc:ID",
   "scope": "document",
   "type": "text",
   "required": true
  },
  {
   "id": "doc.uuid",
   "group": "doc",
   "label": "ETTN",
   "xpath": "cbc:UUID",
   "scope": "document",
   "type": "text",
   "required": true
  },
  {
   "id": "doc.issueDate",
   "group": "doc",
   "label": "Fatura Tarihi",
   "xpath": "cbc:IssueDate",
   "scope": "document",
   "type": "date",
   "required": true
  },
  {
   "id": "doc.issueTime",
   "group": "doc",
   "label": "Fatura Saati",
   "xpath": "cbc:IssueTime",
   "scope": "document",
   "type": "time"
  },
  {
   "id": "doc.profile",
   "group": "doc",
   "label": "Senaryo",
   "xpath": "cbc:ProfileID",
   "scope": "document",
   "type": "code",
   "codelist": "ProfileID",
   "required": true
  },
  {
   "id": "doc.typeCode",
   "group": "doc",
   "label": "Fatura Tipi",
   "xpath": "cbc:InvoiceTypeCode",
   "scope": "document",
   "type": "code",
   "codelist": "InvoiceTypeCode",
   "required": true
  },
  {
   "id": "doc.currency",
   "group": "doc",
   "label": "Para Birimi",
   "xpath": "cbc:DocumentCurrencyCode",
   "scope": "document",
   "type": "code",
   "required": true
  },
  {
   "id": "doc.lineCount",
   "group": "doc",
   "label": "Satır Sayısı",
   "xpath": "cbc:LineCountNumeric",
   "scope": "document",
   "type": "number"
  },
  {
   "id": "doc.copyIndicator",
   "group": "doc",
   "label": "Kopya mı",
   "xpath": "cbc:CopyIndicator",
   "scope": "document",
   "type": "boolean"
  },
  {
   "id": "doc.customization",
   "group": "doc",
   "label": "Customization",
   "xpath": "cbc:CustomizationID",
   "scope": "document",
   "type": "text"
  },
  {
   "id": "doc.note",
   "group": "note",
   "label": "Not (tümü)",
   "xpath": "cbc:Note",
   "scope": "document",
   "type": "text",
   "note": "repeating; codegen renders each"
  },
  {
   "id": "doc.exchangeRate",
   "group": "doc",
   "label": "Döviz Kuru",
   "xpath": "cac:PricingExchangeRate/cbc:CalculationRate",
   "scope": "document",
   "type": "number"
  },
  {
   "id": "doc.exchangeSource",
   "group": "doc",
   "label": "Kur Kaynak Para",
   "xpath": "cac:PricingExchangeRate/cbc:SourceCurrencyCode",
   "scope": "document",
   "type": "code"
  },
  {
   "id": "supplier.name",
   "group": "supplier",
   "label": "Satıcı Unvan",
   "xpath": "cac:AccountingSupplierParty/cac:Party/cac:PartyName/cbc:Name",
   "scope": "document",
   "type": "text",
   "required": true
  },
  {
   "id": "supplier.personName",
   "group": "supplier",
   "label": "Satıcı Ad Soyad",
   "xpath": "concat(cac:AccountingSupplierParty/cac:Party/cac:Person/cbc:FirstName,' ',cac:AccountingSupplierParty/cac:Party/cac:Person/cbc:FamilyName)",
   "scope": "document",
   "type": "text"
  },
  {
   "id": "supplier.vkn",
   "group": "supplier",
   "label": "Satıcı VKN",
   "xpath": "cac:AccountingSupplierParty/cac:Party/cac:PartyIdentification/cbc:ID[@schemeID='VKN']",
   "scope": "document",
   "type": "text"
  },
  {
   "id": "supplier.tckn",
   "group": "supplier",
   "label": "Satıcı TCKN",
   "xpath": "cac:AccountingSupplierParty/cac:Party/cac:PartyIdentification/cbc:ID[@schemeID='TCKN']",
   "scope": "document",
   "type": "text"
  },
  {
   "id": "supplier.taxId",
   "group": "supplier",
   "label": "Satıcı VKN/TCKN",
   "xpath": "cac:AccountingSupplierParty/cac:Party/cac:PartyIdentification/cbc:ID[@schemeID='VKN' or @schemeID='TCKN']",
   "scope": "document",
   "type": "text",
   "required": true
  },
  {
   "id": "supplier.mersis",
   "group": "supplier",
   "label": "Satıcı MERSİS",
   "xpath": "cac:AccountingSupplierParty/cac:Party/cac:PartyIdentification/cbc:ID[@schemeID='MERSISNO']",
   "scope": "document",
   "type": "text"
  },
  {
   "id": "supplier.ticaretSicil",
   "group": "supplier",
   "label": "Satıcı Ticaret Sicil",
   "xpath": "cac:AccountingSupplierParty/cac:Party/cac:PartyIdentification/cbc:ID[@schemeID='TICARETSICILNO']",
   "scope": "document",
   "type": "text"
  },
  {
   "id": "supplier.taxOffice",
   "group": "supplier",
   "label": "Satıcı Vergi Dairesi",
   "xpath": "cac:AccountingSupplierParty/cac:Party/cac:PartyTaxScheme/cac:TaxScheme/cbc:Name",
   "scope": "document",
   "type": "text"
  },
  {
   "id": "supplier.street",
   "group": "supplier",
   "label": "Satıcı Cadde/Sokak",
   "xpath": "cac:AccountingSupplierParty/cac:Party/cac:PostalAddress/cbc:StreetName",
   "scope": "document",
   "type": "text"
  },
  {
   "id": "supplier.buildingName",
   "group": "supplier",
   "label": "Satıcı Bina Adı",
   "xpath": "cac:AccountingSupplierParty/cac:Party/cac:PostalAddress/cbc:BuildingName",
   "scope": "document",
   "type": "text"
  },
  {
   "id": "supplier.buildingNo",
   "group": "supplier",
   "label": "Satıcı Bina No",
   "xpath": "cac:AccountingSupplierParty/cac:Party/cac:PostalAddress/cbc:BuildingNumber",
   "scope": "document",
   "type": "text"
  },
  {
   "id": "supplier.room",
   "group": "supplier",
   "label": "Satıcı Kapı No",
   "xpath": "cac:AccountingSupplierParty/cac:Party/cac:PostalAddress/cbc:Room",
   "scope": "document",
   "type": "text"
  },
  {
   "id": "supplier.district",
   "group": "supplier",
   "label": "Satıcı İlçe",
   "xpath": "cac:AccountingSupplierParty/cac:Party/cac:PostalAddress/cbc:CitySubdivisionName",
   "scope": "document",
   "type": "text"
  },
  {
   "id": "supplier.city",
   "group": "supplier",
   "label": "Satıcı İl",
   "xpath": "cac:AccountingSupplierParty/cac:Party/cac:PostalAddress/cbc:CityName",
   "scope": "document",
   "type": "text"
  },
  {
   "id": "supplier.postalZone",
   "group": "supplier",
   "label": "Satıcı Posta Kodu",
   "xpath": "cac:AccountingSupplierParty/cac:Party/cac:PostalAddress/cbc:PostalZone",
   "scope": "document",
   "type": "text"
  },
  {
   "id": "supplier.region",
   "group": "supplier",
   "label": "Satıcı Mahalle/Bölge",
   "xpath": "cac:AccountingSupplierParty/cac:Party/cac:PostalAddress/cbc:Region",
   "scope": "document",
   "type": "text"
  },
  {
   "id": "supplier.country",
   "group": "supplier",
   "label": "Satıcı Ülke",
   "xpath": "cac:AccountingSupplierParty/cac:Party/cac:PostalAddress/cac:Country/cbc:Name",
   "scope": "document",
   "type": "text"
  },
  {
   "id": "supplier.phone",
   "group": "supplier",
   "label": "Satıcı Telefon",
   "xpath": "cac:AccountingSupplierParty/cac:Party/cac:Contact/cbc:Telephone",
   "scope": "document",
   "type": "text"
  },
  {
   "id": "supplier.fax",
   "group": "supplier",
   "label": "Satıcı Faks",
   "xpath": "cac:AccountingSupplierParty/cac:Party/cac:Contact/cbc:Telefax",
   "scope": "document",
   "type": "text"
  },
  {
   "id": "supplier.email",
   "group": "supplier",
   "label": "Satıcı E-posta",
   "xpath": "cac:AccountingSupplierParty/cac:Party/cac:Contact/cbc:ElectronicMail",
   "scope": "document",
   "type": "text"
  },
  {
   "id": "supplier.website",
   "group": "supplier",
   "label": "Satıcı Web",
   "xpath": "cac:AccountingSupplierParty/cac:Party/cbc:WebsiteURI",
   "scope": "document",
   "type": "text"
  },
  {
   "id": "customer.name",
   "group": "customer",
   "label": "Alıcı Unvan",
   "xpath": "cac:AccountingCustomerParty/cac:Party/cac:PartyName/cbc:Name",
   "scope": "document",
   "type": "text",
   "required": false
  },
  {
   "id": "customer.personName",
   "group": "customer",
   "label": "Alıcı Ad Soyad",
   "xpath": "concat(cac:AccountingCustomerParty/cac:Party/cac:Person/cbc:FirstName,' ',cac:AccountingCustomerParty/cac:Party/cac:Person/cbc:FamilyName)",
   "scope": "document",
   "type": "text"
  },
  {
   "id": "customer.vkn",
   "group": "customer",
   "label": "Alıcı VKN",
   "xpath": "cac:AccountingCustomerParty/cac:Party/cac:PartyIdentification/cbc:ID[@schemeID='VKN']",
   "scope": "document",
   "type": "text"
  },
  {
   "id": "customer.tckn",
   "group": "customer",
   "label": "Alıcı TCKN",
   "xpath": "cac:AccountingCustomerParty/cac:Party/cac:PartyIdentification/cbc:ID[@schemeID='TCKN']",
   "scope": "document",
   "type": "text"
  },
  {
   "id": "customer.taxId",
   "group": "customer",
   "label": "Alıcı VKN/TCKN",
   "xpath": "cac:AccountingCustomerParty/cac:Party/cac:PartyIdentification/cbc:ID[@schemeID='VKN' or @schemeID='TCKN']",
   "scope": "document",
   "type": "text",
   "required": true
  },
  {
   "id": "customer.mersis",
   "group": "customer",
   "label": "Alıcı MERSİS",
   "xpath": "cac:AccountingCustomerParty/cac:Party/cac:PartyIdentification/cbc:ID[@schemeID='MERSISNO']",
   "scope": "document",
   "type": "text"
  },
  {
   "id": "customer.ticaretSicil",
   "group": "customer",
   "label": "Alıcı Ticaret Sicil",
   "xpath": "cac:AccountingCustomerParty/cac:Party/cac:PartyIdentification/cbc:ID[@schemeID='TICARETSICILNO']",
   "scope": "document",
   "type": "text"
  },
  {
   "id": "customer.taxOffice",
   "group": "customer",
   "label": "Alıcı Vergi Dairesi",
   "xpath": "cac:AccountingCustomerParty/cac:Party/cac:PartyTaxScheme/cac:TaxScheme/cbc:Name",
   "scope": "document",
   "type": "text"
  },
  {
   "id": "customer.street",
   "group": "customer",
   "label": "Alıcı Cadde/Sokak",
   "xpath": "cac:AccountingCustomerParty/cac:Party/cac:PostalAddress/cbc:StreetName",
   "scope": "document",
   "type": "text"
  },
  {
   "id": "customer.buildingName",
   "group": "customer",
   "label": "Alıcı Bina Adı",